{
  "baseline_authority": "Task/11_REFERENCE_BASELINE.md",
  "entries": [
    {
      "aggregate_sha256": "a46c29f1d5822820bf1eec1dbf8b0d91e1ccc5849772dbd4c5b521f74ede1ca3",
      "baseline_authority": "Task/11_REFERENCE_BASELINE.md",
      "confirmation": {
        "actor_ref": "USER-PROVIDED-BASELINE",
        "change_reason": "M0_INITIAL_REGISTRATION",
        "confirmed_on": "2026-07-25",
        "gold_revision": 1,
        "previous_aggregate_sha256": null,
        "status": "user-provided-project-baseline"
      },
      "copy_policy": "copy-on-use",
      "expected_outcome": "pass",
      "extensions": {},
      "formats": [
        ".pdf"
      ],
      "license_status": "local-use-only",
      "local_mapping_required": true,
      "logical_id": "REF-ANSWER-SHEET-GOLD",
      "member_count": 1,
      "members": [
        {
          "bytes": 109735,
          "extensions": {},
          "format": ".pdf",
          "member_id": "MEMBER-001",
          "page_count": 6,
          "page_sizes_mm": [
            [
              210.009,
              297.004
            ]
          ],
          "sha256": "7b9baf1e0419d7a8cd31488e3b9092c3e3d055a116fdcdd1bc38a075b1684d5f",
          "structural_status": "readable"
        }
      ],
      "page_count": 6,
      "page_sizes_mm": [
        [
          210.009,
          297.004
        ]
      ],
      "pii_classification": "none",
      "requirement_ids": [
        "M0-GOLD-REGISTRY",
        "M0-TEMPLATE-FAMILIES",
        "M0-VISUAL-BASELINE"
      ],
      "risk_ids": [
        "R-007",
        "R-009"
      ],
      "source_kind": "file",
      "template_family_ids": [
        "TEMPLATE-ANSWER-SHEET-A3-A4"
      ],
      "test_copy_ref": null,
      "total_bytes": 109735,
      "truth_roles": [
        "template",
        "visual"
      ],
      "verification_status": "machine_fingerprinted_role_from_project_baseline"
    },
    {
      "aggregate_sha256": "ae30884c0e740f02496c5ef36847e1158257e19c4baf27aa013f36c5a0a74359",
      "baseline_authority": "Task/11_REFERENCE_BASELINE.md",
      "confirmation": {
        "actor_ref": "USER-PROVIDED-BASELINE",
        "change_reason": "M0_INITIAL_REGISTRATION",
        "confirmed_on": "2026-07-25",
        "gold_revision": 1,
        "previous_aggregate_sha256": null,
        "status": "user-provided-project-baseline"
      },
      "copy_policy": "copy-on-use",
      "expected_outcome": "review",
      "extensions": {},
      "formats": [
        ".pdf"
      ],
      "license_status": "local-use-only",
      "local_mapping_required": true,
      "logical_id": "REF-CONTENT-HISTORY",
      "member_count": 1,
      "members": [
        {
          "bytes": 13547660,
          "extensions": {},
          "format": ".pdf",
          "member_id": "MEMBER-001",
          "page_count": 1207,
          "page_sizes_mm": [
            [
              420.0,
              297.0
            ]
          ],
          "sha256": "d02d0f16371fa96f4b8f7c0cfe43eceaea7df5f57ad83880e8cb27497b32f472",
          "structural_status": "readable"
        }
      ],
      "page_count": 1207,
      "page_sizes_mm": [
        [
          420.0,
          297.0
        ]
      ],
      "pii_classification": "none",
      "requirement_ids": [
        "M0-GOLD-REGISTRY",
        "M0-TEMPLATE-FAMILIES"
      ],
      "risk_ids": [
        "R-007",
        "R-028"
      ],
      "source_kind": "file",
      "template_family_ids": [
        "TEMPLATE-TRUE-QUESTION-A3-LANDSCAPE"
      ],
      "test_copy_ref": null,
      "total_bytes": 13547660,
      "truth_roles": [
        "content",
        "template"
      ],
      "verification_status": "machine_fingerprinted_role_from_project_baseline"
    },
    {
      "aggregate_sha256": "2d6cbdb9d152c11fc4b4ccd5f2fdae9d3f4b736e36d67d9e750ae96a83257d82",
      "baseline_authority": "Task/11_REFERENCE_BASELINE.md",
      "confirmation": {
        "actor_ref": "USER-PROVIDED-BASELINE",
        "change_reason": "M0_INITIAL_REGISTRATION",
        "confirmed_on": "2026-07-25",
        "gold_revision": 1,
        "previous_aggregate_sha256": null,
        "status": "user-provided-project-baseline"
      },
      "copy_policy": "copy-on-use",
      "expected_outcome": "review",
      "extensions": {},
      "formats": [
        ".docx"
      ],
      "license_status": "user-owned",
      "local_mapping_required": true,
      "logical_id": "REF-EDITABLE-PAPER-SET",
      "member_count": 3,
      "members": [
        {
          "bytes": 361695,
          "extensions": {},
          "format": ".docx",
          "member_id": "MEMBER-001",
          "page_count": null,
          "page_sizes_mm": [
            [
              184.027,
              260.032
            ]
          ],
          "sha256": "e9599f2ac88fc5ec56dbfdbc6a04eccc07a3139f5d7089f28df5fb04556e16df",
          "structural_status": "readable"
        },
        {
          "bytes": 596750,
          "extensions": {},
          "format": ".docx",
          "member_id": "MEMBER-002",
          "page_count": null,
          "page_sizes_mm": [
            [
              210.009,
              297.004
            ]
          ],
          "sha256": "15ba6530a3588c18021c9c68f47579d2718c31146fcf1c4185dc68323ca84143",
          "structural_status": "readable"
        },
        {
          "bytes": 776680,
          "extensions": {},
          "format": ".docx",
          "member_id": "MEMBER-003",
          "page_count": null,
          "page_sizes_mm": [
            [
              210.009,
              297.004
            ]
          ],
          "sha256": "ec8db2c494a7b0f23b64af0b849c8bb2d81b3c935f2ce52422b610c31509ed5b",
          "structural_status": "readable"
        }
      ],
      "page_count": null,
      "page_sizes_mm": [
        [
          184.027,
          260.032
        ],
        [
          210.009,
          297.004
        ]
      ],
      "pii_classification": "none",
      "requirement_ids": [
        "M0-GOLD-REGISTRY",
        "M0-TEMPLATE-FAMILIES"
      ],
      "risk_ids": [
        "R-007",
        "R-008",
        "R-009"
      ],
      "source_kind": "set",
      "template_family_ids": [
        "TEMPLATE-EDITABLE-B5-184X260",
        "TEMPLATE-OFFICIAL-A4"
      ],
      "test_copy_ref": null,
      "total_bytes": 1735125,
      "truth_roles": [
        "template",
        "visual"
      ],
      "verification_status": "machine_fingerprinted_role_from_project_baseline"
    },
    {
      "aggregate_sha256": "eca99eb26e466975a4d79d7b97b7f53cf45389c247e704fa1743018772b29177",
      "baseline_authority": "Task/11_REFERENCE_BASELINE.md",
      "confirmation": {
        "actor_ref": "USER-PROVIDED-BASELINE",
        "change_reason": "M0_INITIAL_REGISTRATION",
        "confirmed_on": "2026-07-25",
        "gold_revision": 1,
        "previous_aggregate_sha256": null,
        "status": "user-provided-project-baseline"
      },
      "copy_policy": "copy-on-use",
      "expected_outcome": "reject",
      "extensions": {},
      "formats": [
        ".svg"
      ],
      "license_status": "user-owned",
      "local_mapping_required": true,
      "logical_id": "REF-FIG-BROKEN-SVG",
      "member_count": 1,
      "members": [
        {
          "bytes": 3592,
          "extensions": {},
          "format": ".svg",
          "member_id": "MEMBER-001",
          "page_count": null,
          "page_sizes_mm": [],
          "sha256": "51c62d3b56ae2daaeaff8d59606a927246e3daae7336c64d95fea4b8e4a27cdf",
          "structural_status": "invalid_expected"
        }
      ],
      "page_count": null,
      "page_sizes_mm": [],
      "pii_classification": "none",
      "requirement_ids": [
        "M0-FAILURE-GOLD",
        "M0-GOLD-REGISTRY"
      ],
      "risk_ids": [
        "R-016",
        "R-017"
      ],
      "source_kind": "file",
      "template_family_ids": [
        "TEMPLATE-FIGURE-THREE-TRACK"
      ],
      "test_copy_ref": null,
      "total_bytes": 3592,
      "truth_roles": [
        "failure",
        "figure"
      ],
      "verification_status": "machine_fingerprinted_role_from_project_baseline"
    },
    {
      "aggregate_sha256": "322d776dcac03ce0d40d317c70fbe61a39eb9ef1940a35a2b349b7d811764f39",
      "baseline_authority": "Task/11_REFERENCE_BASELINE.md",
      "confirmation": {
        "actor_ref": "USER-PROVIDED-BASELINE",
        "change_reason": "M0_INITIAL_REGISTRATION",
        "confirmed_on": "2026-07-25",
        "gold_revision": 1,
        "previous_aggregate_sha256": null,
        "status": "user-provided-project-baseline"
      },
      "copy_policy": "copy-on-use",
      "expected_outcome": "pass",
      "extensions": {},
      "formats": [
        ".svg"
      ],
      "license_status": "user-owned",
      "local_mapping_required": true,
      "logical_id": "REF-FIG-GEOMETRY-SET",
      "member_count": 3,
      "members": [
        {
          "bytes": 1557,
          "extensions": {},
          "format": ".svg",
          "member_id": "MEMBER-001",
          "page_count": null,
          "page_sizes_mm": [],
          "sha256": "fb1b192aec8acf7ab8c1609549d09a89718c529386a4bf492f626846a35edfb7",
          "structural_status": "readable"
        },
        {
          "bytes": 2828,
          "extensions": {},
          "format": ".svg",
          "member_id": "MEMBER-002",
          "page_count": null,
          "page_sizes_mm": [],
          "sha256": "31e3a9d7220399eada5cd58c8a0a097497efef01d8a83ae6024f5b99c8adead0",
          "structural_status": "readable"
        },
        {
          "bytes": 4518,
          "extensions": {},
          "format": ".svg",
          "member_id": "MEMBER-003",
          "page_count": null,
          "page_sizes_mm": [],
          "sha256": "d7edfeb373c159190bbca73d153ab582ead3e4ba85487cf11153c4e3df3c14b3",
          "structural_status": "readable"
        }
      ],
      "page_count": null,
      "page_sizes_mm": [],
      "pii_classification": "none",